{
  "chronology_rule": "effective_at_lte_freshness_as_of_lte_verified_at",
  "current_state_rule": "current_requires_exact_governing_manifest_and_authority",
  "cutoff_rule": "evidence_clocks_lte_cutoff_custody_assessment_may_follow",
  "policy_id": "tunsil-absence-shock-v0-freshness",
  "schema_version": "research-freshness-policy/v1"
}
